{
  "schema": "Llmrecog.Internal.DogfoodFeedback.v1",
  "feedback_id": "LOCAL_PATH_DIGEST_20260814_01_FEEDBACK_01",
  "receipt": {
    "path": "dogfood/runs/LOCAL_PATH_DIGEST_20260814_01/receipt.json",
    "digest": "sha256:ec4c97e7a7d0b096ecd8f838dcc2befd60c0a05c3f72e13340b93ca186c0cebe"
  },
  "reviewed_at": "2026-08-14T19:36:52+09:00",
  "reviewer": "codex",
  "supersedes": null,
  "entries": [
    {
      "observation_id": "OBS-SOURCE-001",
      "disposition": "accepted",
      "rationale": "The shared receipt schema omitted the new round and protocol path. Protocol v13 and additive process-schema values corrected that pre-run evidence boundary without changing the public recognition or source-verification contracts.",
      "contract_change": "not_required",
      "action_task_ids": ["APPLY_DIGEST_FEEDBACK_AND_COMPLETE_VERIFIER"]
    }
  ],
  "point_adjustments": [
    {
      "plan_path": "plans/phase-5-local-source-verification.pert",
      "task_id": "APPLY_DIGEST_FEEDBACK_AND_COMPLETE_VERIFIER",
      "previous_points": 3,
      "revised_points": 3,
      "rationale": "The receipt-schema correction was completed within the dogfood slice, and the runtime evidence found no additional rooted-path or digest work; retain 3p for strict UTF-8, Unicode-scalar ranges, exact quotes, fixtures, and checks."
    }
  ],
  "round_complete": true,
  "unresolved_observation_ids": []
}
